{
  "run_id": "RUN_20260603-000000",
  "paradigm": "nenflow-v3",
  "maxSubagents": 1,
  "maxRetries": 5,
  "concurrency": 1,
  "roles": [
    {
      "agentName": "pev-researcher",
      "role": "researcher",
      "model": "deepseek-v4-pro",
      "provider": "deepseek"
    },
    {
      "agentName": "pev-planner",
      "role": "planner",
      "model": "deepseek-v4-pro",
      "provider": "deepseek"
    },
    {
      "agentName": "pev-executor",
      "role": "executor",
      "model": "deepseek-v4-pro",
      "provider": "deepseek"
    },
    {
      "agentName": "pev-verifier",
      "role": "verifier",
      "model": "deepseek-v4-flash",
      "provider": "deepseek"
    }
  ]
}
