{
  "run_id": "RUN_20260603-010000",
  "paradigm": "nenflow-v3-multi-hypothesis",
  "maxSubagents": 1,
  "maxRetries": 3,
  "concurrency": 1,
  "roles": [
    {
      "agentName": "pev-researcher",
      "role": "hypothesizer-1",
      "model": "gpt-5.5",
      "provider": "openai-codex"
    },
    {
      "agentName": "pev-researcher",
      "role": "hypothesizer-2",
      "model": "gpt-5.5",
      "provider": "openai-codex"
    },
    {
      "agentName": "pev-researcher",
      "role": "hypothesizer-3",
      "model": "gpt-5.5",
      "provider": "openai-codex"
    },
    {
      "agentName": "pev-planner",
      "role": "critique",
      "model": "gpt-5.5",
      "provider": "openai-codex"
    },
    {
      "agentName": "pev-planner",
      "role": "synthesizer-planner",
      "model": "gpt-5.5",
      "provider": "openai-codex"
    },
    {
      "agentName": "pev-executor",
      "role": "executor",
      "model": "deepseek-v4-pro",
      "provider": "deepseek"
    },
    {
      "agentName": "pev-verifier",
      "role": "verifier",
      "model": "deepseek-v4-flash",
      "provider": "deepseek"
    }
  ]
}
